Адрес помещения для голосования;учреждение;номера участков; количество участков в учреждении
г.Мурманск, ул. Торцева, д. 14;МОУ Школа искусств № 3;1;1
г.Мурманск, ул. Торцева, д. 1;МОУ ВСОШ №7;2;1
г.Мурманск, улица Нахимова, дом № 21;Кинотеатр «Аврора»;3;1
г.Мурманск, ул. Сафонова, д. 37;МОУ СОШ №38;4;1
г.Мурманск, ул. Сафонова, д. 18;МОУ начальная школа - детский сад №14;5;1
г.Мурманск, ул. Сафонова, д. 11;МОУ СОШ №57;6;1
г.Мурманск, ул. Адмирала Лобова, д. 18;МОУ Межшкольный учебный комбинат ;7;1
г.Мурманск, просп. Героев-североморцев, д. 76, корп. 3;МОУ СОШ №41;8, 9, 10, 11;4
г.Мурманск, ул. А. Невского, д. 86;ГООУ СПО «Мурманский строительный колледж им. М.Е.Момота»;12,13, 14;3
г.Мурманск, ул. Чумбарова-Лучинского, д. 3б;МОУ СОШ №18;15, 16, 17;3
г.Мурманск, пер. Казарменный, д. 2;СДЮШОР №4 ;18;1
г.Мурманск, ул. Халатина, д. 17;МОУ СОШ №45;19,20;2
г.Мурманск, ул. Халатина, д. 7;Мурманский  институт  Санкт-Петербургской Академии управления и экономики;21;1
г.Мурманск, ул. Аскольдовцев, д. 9/22;МОУ  гимназия № 4;22, 23;2
г.Мурманск, ул. Александрова, д. 32, корп. 2;МОУ СОШ №5;24, 25;2
г.Мурманск, ул. Ивченко, д. 15;МОУ гимназия № 9 ;26, 27, 28;3
г.Мурманск, ул. Гаджиева, д. 6а;МОУ СОШ №11;29, 30;2
г.Мурманск, ул. Миронова, д. 5;МОУ СОШ №44;31, 32, 34;3
г.Мурманск, ул. Гагарина, д. 21;МУП ОУ «Детский морской центр Океан»;33;1
г.Мурманск, ул. Подстаницкого, д. 1;ГОУ «МФЦ МО» ;35;1
г.Мурманск, просп. Героев-североморцев, д. 5, корп. 3;Общежитие ООО «УК «Гарант»;36;1
г.Мурманск, ул. П. Морозова, д. 3;МОУ СОШ №26;37, 38;2
г.Мурманск, ул. Туристов, д. 34а;МОУ прогимназия № 61;39;1
г.Мурманск, ул. К. Либкнехта, д. 34а;"Общежитие ОАО ""Мурманский морской торговый порт""";40;1
г.Мурманск, ул. Челюскинцев, д. 14;МОУ гимназия № 3;41, 42;2
г.Мурманск, ул. К. Либкнехта, дом 18а;МОУ СОШ №34;46, 47;2
г.Мурманск, ул. Володарского, дом 5;Мурманский педагогический колледж;48;1
г.Мурманск, ул. К. Маркса, дом 13;МОУ гимназия № 5;49;1
г.Мурманск, ул. Софьи Перовской, дом 3;Областной Центр Культуры;50;1
г.Мурманск, ул. Пушкинская, дом 3;ГУК Мурманский областной Дворец культуры им. С.М. Кирова;51;1
г.Мурманск, ул. капитана Егорова, дом 5;Филиал НОУ ВПО Балтийский институт экологии, политики и управления в городе Мурманске;52;1
г.Мурманск, ул. Комсомольская, дом 13;МОУ СОШ №36;53;1
г.Мурманск, ул. Папанина, дом 3;МОУ СОШ №53;54, 55, 56;3
г.Мурманск, ул. Седова, дом 8;МОУ СОШ №56;57, 58;2
г.Мурманск, ул. Мира, дом 12;МОУ СОШ №49;59, 60, 61;3
г.Мурманск, ул. Скальная, дом 12;МОУ СОШ №49;62,63;2
г.Мурманск, ул. капитана Маклакова, дом 39;МОУ специальная коррекционная общеобразовательная школа №58;64, 65;2
г.Мурманск, проезд Связи, дом 30;МОУ  гимназия № 1;66, 67;2
г.Мурманск, ул. Полярные Зори, дом 60;ГОУ СПО Мурманский колледж экономики, статистики и информатики;68, 69;2
г.Мурманск, ул. капитана Буркова , дом 31;МОУ СОШ №1;70, 73;2
г.Мурманск, проезд Лыжный, дом № 8;МОУ средняя общеобразовательная школа № 23 ;71;1
г.Мурманск, проезд капитана Тарана, дом 1;МОУ для детей дошкольного и младшего школьного возраста прогимназия № 40 г. Мурманска;72;1
г.Мурманск, ул. Книповича, дом 36а;МОУ СОШ №43;74, 75;2
г.Мурманск, проспект Ленина, дом 59;МОУ г. Мурманска гимназия  № 2;76, 78;2
г.Мурманск, ул. Самойловой, дом 2;МОУ г. Мурманска лицей  № 2;77;1
г.Мурманск, ул. Книповича, дом 35/2;МОУ г. Мурманска гимназия  № 8;79, 80;2
г.Мурманск, ул. Книповича, дом 36а;МОУ СОШ №43;81;1
г.Мурманск, улица Книповича, дом № 48, каб.109;Управление государственной службы занятости населения Мурманской области;82;1
г.Мурманск, ул. Полярной Дивизии, дом 1/16;МОУ СОШ №12;83;1
г.Мурманск, пр. Ленина, дом 14;МОУ ДОД Детская театральная школа ;84, 85;2
г.Мурманск, ул. Полярные Зори, дом 1;Кооперативный техникум Мурманского  облпотребсоюза;86;1
г.Мурманск, ул. Гвардейская, дом 14;ГООУСПО  Мурманский технологический колледж сервиса;87;1
г.Мурманск, ул. Рылеева, дом 6;ГОУ дополнительного образования детей Мурманской области Центр детского и юношеского туризма и экскурсий;88;1
г.Мурманск, ул. Чехова, дом 11;МОУ СОШ №28;89, 90;2
г.Мурманск, ул. Подгорная, д. 80;ГОУ НПО «Мурманский индустриальный лицей»;99;1
г.Мурманск, улица Туристов, дом № 34а;МОУ прогимназия № 61;100;1
г.Мурманск, ул. Спортивная, д. 13 ;Мурманский государственный технический университет;101;1
г.Мурманск, улица Генералова, дом № 1/13;МУО г. Мурманска «Городской информационно-методический центр работников образования»;102;1
г.Мурманск, ул. Кирова, д. 17А;МОУ ДОД  г.Мурманска  ДЮСШ № 7;103;1
г.Мурманск, пр. Кирова, д. 36/27;МОУ СОШ №37;104, 105;2
г.Мурманск, ул. Капитана Орликовой, д. 35;МОУ СОШ №50;106, 108, 109;3
г.Мурманск, ул. Лесная, д. 39;"Дом культуры ""Маяк""";107;1
г.Мурманск, пр. Кольский, д. 27;РК «Сфера»;110;1
г.Мурманск, пр. Кольский, д. 27А;ООО «Рента»;111;1
г.Мурманск, Лыжный проезд, д. 8 ;МОУ СОШ №23;112, 113;2
г.Мурманск, ул. Зои Космодемьянской, д. 13 ;МОУ гимназия № 7;114, 115;2
г.Мурманск, ул. Олега Кошевого, д.12;МОУ СОШ №17;116, 117;2
г.Мурманск, ул. Зои Космодемьянской, 2А;"городской Дом культуры ""Первомайский""";118;1
г.Мурманск, ул. Спартака, д. 11;МОУ «Кадетская школа г. Мурманска»;119, 120;2
г.Мурманск, ул. Бочкова, д. 15 ;МОУ СОШ №27;121, 122,123;3
г.Мурманск, ул. Баумана, д. 11;МОУ гимназия № 10;124, 125;2
г.Мурманск, ул. Беринга, д. 18;МОУ гимназия № 6;126, 127, 128;3
г.Мурманск, Ледокольный проезд, д. 23;МОУ г. Мурманска «Мурманский международный лицей»;129, 130;2
г.Мурманск, переулок Якорный, д.5;МОУ СОШ №13;131, 132;2
г.Мурманск, ул. Героев Рыбачьего, д. 15;МОУ СОШ №42;133, 139, 140;3
г.Мурманск, улица Лобова, дом № 47;МУК «Дом культуры Ленинского округа города Мурманска»;134;1
г.Мурманск, ул. Баумана, д. 40;МОУ СОШ №20;135, 136;2
г.Мурманск, ул. Баумана, д. 39;Мурманская областная специальная общеобразовательная школа-интернат № 3;137;1
г.Мурманск, ул. Баумана, д. 44;МОУ ДОД г. Мурманска «Первомайский дом детского творчества»;138;1
г.Мурманск, ул. Капитана Копытова, д. 36;МОУ СОШ №22;141, 142, 143, 144;4
г.Мурманск, ул. Крупской, д. 13;МОУ СОШ №33;145, 146;2
г.Мурманск, ул. Героев Рыбачьего, д. 58;МОУ СОШ №31;147, 148;2
г.Мурманск, ул. Крупской, д. 26;МОУ СОШ №21;149, 150;2
г.Мурманск, ул. Прибрежная, д. 2;МОУ СОШ №6;151;1